name	dataset	caption	audio_path	duration	mel_path	struct_cap
Ducks_quack_rapidly_and_loudly_nearby.wav	audiocaps	Ducks quack rapidly and loudly nearby	audio_wav_train/Ducks_quack_rapidly_and_loudly_nearby.wav	10.0	audio_wav_train_mel/Ducks_quack_rapidly_and_loudly_nearby_mel.npy.npy	<ducks quack rapidly and loudly& all>
A_clicking_sound,_banging_four_times,_then_clicking_again.wav	audiocaps	A clicking sound, banging four times, then clicking again	audio_wav_train/A_clicking_sound,_banging_four_times,_then_clicking_again.wav	10.0	audio_wav_train_mel/A_clicking_sound,_banging_four_times,_then_clicking_again_mel.npy.npy	<clicking sound& start>@<banging four times& mid>@<clicking again& end>
Shaking_or_rubbing_and_squeaking_noise_while_a_man_speaks.wav	audiocaps	Shaking or rubbing and squeaking noise while a man speaks	audio_wav_train/Shaking_or_rubbing_and_squeaking_noise_while_a_man_speaks.wav	10.0	audio_wav_train_mel/Shaking_or_rubbing_and_squeaking_noise_while_a_man_speaks_mel.npy.npy	<man speaks& all>@<shaking or rubbing noise& all>@<squeaking noise& all>
A_cat_is_meowing.wav	audiocaps	A cat is meowing	audio_wav_train/A_cat_is_meowing.wav	10.0	audio_wav_train_mel/A_cat_is_meowing_mel.npy.npy	<cat is meowing& all>
A_small_engine_hums_and_hisses_continually_nearby.wav	audiocaps	A small engine hums and hisses continually nearby	audio_wav_train/A_small_engine_hums_and_hisses_continually_nearby.wav	10.0	audio_wav_train_mel/A_small_engine_hums_and_hisses_continually_nearby_mel.npy.npy	<small engine hums and hisses continually& all>
A_crowd_claps,_and_two_quick_thumps_occur_while_the_crowd_is_shouting_and_talking.wav	audiocaps	A crowd claps, and two quick thumps occur while the crowd is shouting and talking	audio_wav_train/A_crowd_claps,_and_two_quick_thumps_occur_while_the_crowd_is_shouting_and_talking.wav	10.0	audio_wav_train_mel/A_crowd_claps,_and_two_quick_thumps_occur_while_the_crowd_is_shouting_and_talking_mel.npy.npy	<crowd claps& all>@<two quick thumps& mid>@<crowd shouting and talking& all>
A_machine_gun_fires,_two_people_speak_as_the_gun_is_loaded.wav	audiocaps	A machine gun fires, two people speak as the gun is loaded	audio_wav_train/A_machine_gun_fires,_two_people_speak_as_the_gun_is_loaded.wav	10.0	audio_wav_train_mel/A_machine_gun_fires,_two_people_speak_as_the_gun_is_loaded_mel.npy.npy	<machine gun fires& start>@<two people speak& mid>@<gun is loaded& end>
A_ring,_people_speak_and_cheer.wav	audiocaps	A ring, people speak and cheer	audio_wav_train/A_ring,_people_speak_and_cheer.wav	10.0	audio_wav_train_mel/A_ring,_people_speak_and_cheer_mel.npy.npy	<ring& start>@<people speak& mid>@<people cheer& end>
A_low_electric_hum_and_then_a_dog_cries_a_few_times.wav	audiocaps	A low electric hum and then a dog cries a few times	audio_wav_train/A_low_electric_hum_and_then_a_dog_cries_a_few_times.wav	10.0	audio_wav_train_mel/A_low_electric_hum_and_then_a_dog_cries_a_few_times_mel.npy.npy	<low electric hum& all>@<dog cries& start>
An_emergency_vehicle_siren_sounds_loudly_in_the_distance_as_wind_blows_by.wav	audiocaps	An emergency vehicle siren sounds loudly in the distance as wind blows by	audio_wav_train/An_emergency_vehicle_siren_sounds_loudly_in_the_distance_as_wind_blows_by.wav	10.0	audio_wav_train_mel/An_emergency_vehicle_siren_sounds_loudly_in_the_distance_as_wind_blows_by_mel.npy.npy	<emergency vehicle siren sounds loudly& start>@<wind blows by& all>
Some_surface_is_rubbed_and_an_insect_flies.wav	audiocaps	Some surface is rubbed and an insect flies	audio_wav_train/Some_surface_is_rubbed_and_an_insect_flies.wav	10.0	audio_wav_train_mel/Some_surface_is_rubbed_and_an_insect_flies_mel.npy.npy	<surface is rubbed& all>@<insect flies& end>
A_train_horn_blowing_as_it_moves_on_the_tracks.wav	audiocaps	A train horn blowing as it moves on the tracks	audio_wav_train/A_train_horn_blowing_as_it_moves_on_the_tracks.wav	10.0	audio_wav_train_mel/A_train_horn_blowing_as_it_moves_on_the_tracks_mel.npy.npy	<train horn blowing& all>@<train moves on tracks& all>
Truck_engine_running_then_a_dragging_noise.wav	audiocaps	Truck engine running then a dragging noise	audio_wav_train/Truck_engine_running_then_a_dragging_noise.wav	10.0	audio_wav_train_mel/Truck_engine_running_then_a_dragging_noise_mel.npy.npy	<truck engine running& all>@<dragging noise& end>
Women_speaking_followed_by_dog_barking.wav	audiocaps	Women speaking followed by dog barking	audio_wav_train/Women_speaking_followed_by_dog_barking.wav	10.0	audio_wav_train_mel/Women_speaking_followed_by_dog_barking_mel.npy.npy	<women speaking& all>@<dog barking& start>
A_truck_engine_revs_up,_and_then_a_truck_passes_by.wav	audiocaps	A truck engine revs up, and then a truck passes by	audio_wav_train/A_truck_engine_revs_up,_and_then_a_truck_passes_by.wav	10.0	audio_wav_train_mel/A_truck_engine_revs_up,_and_then_a_truck_passes_by_mel.npy.npy	<truck engine revs up& start>@<truck passes by& all>
A_domestic_animal_is_snoring_and_breathing_loudly.wav	audiocaps	A domestic animal is snoring and breathing loudly	audio_wav_train/A_domestic_animal_is_snoring_and_breathing_loudly.wav	10.0	audio_wav_train_mel/A_domestic_animal_is_snoring_and_breathing_loudly_mel.npy.npy	<domestic animal snoring& all>@<breathing loudly& all>
Two_women_laugh_and_one_speaks.wav	audiocaps	Two women laugh and one speaks	audio_wav_train/Two_women_laugh_and_one_speaks.wav	10.0	audio_wav_train_mel/Two_women_laugh_and_one_speaks_mel.npy.npy	<two women laugh& all>@<one speaks& mid>
Men_speaking_followed_by_a_child_yelling.wav	audiocaps	Men speaking followed by a child yelling	audio_wav_train/Men_speaking_followed_by_a_child_yelling.wav	10.0	audio_wav_train_mel/Men_speaking_followed_by_a_child_yelling_mel.npy.npy	<men speaking& all>@<child yelling& end>
Racing_car_sounds_with_muted_mans_voice.wav	audiocaps	Racing car sounds with muted mans voice	audio_wav_train/Racing_car_sounds_with_muted_mans_voice.wav	10.0	audio_wav_train_mel/Racing_car_sounds_with_muted_mans_voice_mel.npy.npy	<racing car sounds& all>@<muted man's voice& all>
A_man_yelling_and_ducks_in_the_background.wav	audiocaps	A man yelling and ducks in the background	audio_wav_train/A_man_yelling_and_ducks_in_the_background.wav	10.0	audio_wav_train_mel/A_man_yelling_and_ducks_in_the_background_mel.npy.npy	<man yelling& all>@<ducks quacking& all>
A_young_man_is_speaking_and_crumpling_plastic.wav	audiocaps	A young man is speaking and crumpling plastic	audio_wav_train/A_young_man_is_speaking_and_crumpling_plastic.wav	10.0	audio_wav_train_mel/A_young_man_is_speaking_and_crumpling_plastic_mel.npy.npy	<young man speaking& all>@<plastic crumpling& all>
Horses_are_walking_and_various_people_speak.wav	audiocaps	Horses are walking and various people speak	audio_wav_train/Horses_are_walking_and_various_people_speak.wav	10.0	audio_wav_train_mel/Horses_are_walking_and_various_people_speak_mel.npy.npy	<Horses walking& all>@<various people speak& all>
Child_giving_a_speech_and_crowd_clapping.wav	audiocaps	Child giving a speech and crowd clapping	audio_wav_train/Child_giving_a_speech_and_crowd_clapping.wav	10.0	audio_wav_train_mel/Child_giving_a_speech_and_crowd_clapping_mel.npy.npy	<child giving a speech& all>@<crowd clapping& end>
Man_speaks_as_sizzling_occurs.wav	audiocaps	Man speaks as sizzling occurs	audio_wav_train/Man_speaks_as_sizzling_occurs.wav	10.0	audio_wav_train_mel/Man_speaks_as_sizzling_occurs_mel.npy.npy	<male voice talking& all>@<sizzling occurs& all>
Waves_crash_against_the_shore.wav	audiocaps	Waves crash against the shore	audio_wav_train/Waves_crash_against_the_shore.wav	10.0	audio_wav_train_mel/Waves_crash_against_the_shore_mel.npy.npy	<waves crash against the shore& all>
A_vehicle_door_opening_and_closing_as_two_men_are_talking_while_a_dog_is_barking_before_a_vehicle_engine_starts_up_and_accelerates.wav	audiocaps	A vehicle door opening and closing as two men are talking while a dog is barking before a vehicle engine starts up and accelerates	audio_wav_train/A_vehicle_door_opening_and_closing_as_two_men_are_talking_while_a_dog_is_barking_before_a_vehicle_engine_starts_up_and_accelerates.wav	10.0	audio_wav_train_mel/A_vehicle_door_opening_and_closing_as_two_men_are_talking_while_a_dog_is_barking_before_a_vehicle_engine_starts_up_and_accelerates_mel.npy.npy	<vehicle door opening and closing& all>@<men talking& all>@<dog barking& mid>@<vehicle engine starts up& end>@<engine accelerates& end>
A_aircraft_engine_is_turned_on.wav	audiocaps	A aircraft engine is turned on	audio_wav_train/A_aircraft_engine_is_turned_on.wav	10.0	audio_wav_train_mel/A_aircraft_engine_is_turned_on_mel.npy.npy	<aircraft engine is turned on& all>
A_man_is_speaking_followed_by_a_thud.wav	audiocaps	A man is speaking followed by a thud	audio_wav_train/A_man_is_speaking_followed_by_a_thud.wav	10.0	audio_wav_train_mel/A_man_is_speaking_followed_by_a_thud_mel.npy.npy	<man is speaking& all>@<thud& end>
A_large_bell_rings.wav	audiocaps	A large bell rings	audio_wav_train/A_large_bell_rings.wav	10.0	audio_wav_train_mel/A_large_bell_rings_mel.npy.npy	<large bell rings& all>
The_voice_of_two_men_then_a_vehicle_starting.wav	audiocaps	The voice of two men then a vehicle starting	audio_wav_train/The_voice_of_two_men_then_a_vehicle_starting.wav	10.0	audio_wav_train_mel/The_voice_of_two_men_then_a_vehicle_starting_mel.npy.npy	<two men talking& all>@<vehicle starting& end>
Steam_engine_hiss_with_multiple_voices.wav	audiocaps	Steam engine hiss with multiple voices	audio_wav_train/Steam_engine_hiss_with_multiple_voices.wav	10.0	audio_wav_train_mel/Steam_engine_hiss_with_multiple_voices_mel.npy.npy	<steam engine hiss& all>@<multiple voices& all>
People_talks_nearby_as_bees_buzz_loudly_and_rapidly.wav	audiocaps	People talks nearby as bees buzz loudly and rapidly	audio_wav_train/People_talks_nearby_as_bees_buzz_loudly_and_rapidly.wav	10.0	audio_wav_train_mel/People_talks_nearby_as_bees_buzz_loudly_and_rapidly_mel.npy.npy	<people talk nearby& all>@<bees buzz loudly and rapidly& all>
Water_trickles_gently_and_slowly_stops.wav	audiocaps	Water trickles gently and slowly stops	audio_wav_train/Water_trickles_gently_and_slowly_stops.wav	10.0	audio_wav_train_mel/Water_trickles_gently_and_slowly_stops_mel.npy.npy	<water trickles gently& start>@<water slowly stops& end>
A_man_speaks_while_electronics_beeps.wav	audiocaps	A man speaks while electronics beeps	audio_wav_train/A_man_speaks_while_electronics_beeps.wav	10.0	audio_wav_train_mel/A_man_speaks_while_electronics_beeps_mel.npy.npy	<male voice talking& all>@<electronics beeps& all>
A_crowd_applauds_followed_by_a_man_speaking_then_laughter.wav	audiocaps	A crowd applauds followed by a man speaking then laughter	audio_wav_train/A_crowd_applauds_followed_by_a_man_speaking_then_laughter.wav	10.0	audio_wav_train_mel/A_crowd_applauds_followed_by_a_man_speaking_then_laughter_mel.npy.npy	<crowd applauds& start>@<man speaking& mid>@<laughter& end>
A_motorboat_cruises_along,_and_a_man_talks.wav	audiocaps	A motorboat cruises along, and a man talks	audio_wav_train/A_motorboat_cruises_along,_and_a_man_talks.wav	10.0	audio_wav_train_mel/A_motorboat_cruises_along,_and_a_man_talks_mel.npy.npy	<motorboat cruises along& all>@<man talks& all>
Music_and_woman_speaking,_owl_hooting_in_background_and_tapping.wav	audiocaps	Music and woman speaking, owl hooting in background and tapping	audio_wav_train/Music_and_woman_speaking,_owl_hooting_in_background_and_tapping.wav	10.0	audio_wav_train_mel/Music_and_woman_speaking,_owl_hooting_in_background_and_tapping_mel.npy.npy	<music and woman speaking& all>@<owl hooting& mid>@<tapping& end>
A_car_is_racing_away_very_fast_and_its_tires_squeal_a_little.wav	audiocaps	A car is racing away very fast and its tires squeal a little	audio_wav_train/A_car_is_racing_away_very_fast_and_its_tires_squeal_a_little.wav	10.0	audio_wav_train_mel/A_car_is_racing_away_very_fast_and_its_tires_squeal_a_little_mel.npy.npy	<car racing away very fast& all>@<tires squeal a little& mid>
Toilet_flushing.wav	audiocaps	Toilet flushing	audio_wav_train/Toilet_flushing.wav	10.0	audio_wav_train_mel/Toilet_flushing_mel.npy.npy	<toilet flushing& all>
A_woman_speaks_and_then_a_young_man_speaks.wav	audiocaps	A woman speaks and then a young man speaks	audio_wav_train/A_woman_speaks_and_then_a_young_man_speaks.wav	10.0	audio_wav_train_mel/A_woman_speaks_and_then_a_young_man_speaks_mel.npy.npy	<woman speaks& start>@<young man speaks& end>
A_train_passing_by_blaring_its_horn.wav	audiocaps	A train passing by blaring its horn	audio_wav_train/A_train_passing_by_blaring_its_horn.wav	10.0	audio_wav_train_mel/A_train_passing_by_blaring_its_horn_mel.npy.npy	<train passing by& all>@<train blaring horn& all>
A_man_speaks_then_a_horse_neighs_then_a_slap,_a_crash,_and_a_car_alarm.wav	audiocaps	A man speaks then a horse neighs then a slap, a crash, and a car alarm	audio_wav_train/A_man_speaks_then_a_horse_neighs_then_a_slap,_a_crash,_and_a_car_alarm.wav	10.0	audio_wav_train_mel/A_man_speaks_then_a_horse_neighs_then_a_slap,_a_crash,_and_a_car_alarm_mel.npy.npy	<man speaks& all>@<horse neighs& mid>@<slap& mid>@<crash& mid>@<car alarm& end>
A_woman_talks_and_birds_tweet.wav	audiocaps	A woman talks and birds tweet	audio_wav_train/A_woman_talks_and_birds_tweet.wav	10.0	audio_wav_train_mel/A_woman_talks_and_birds_tweet_mel.npy.npy	<woman talks& all>@<birds tweet& all>
An_airplane_engine_running_and_people_talking.wav	audiocaps	An airplane engine running and people talking	audio_wav_train/An_airplane_engine_running_and_people_talking.wav	10.0	audio_wav_train_mel/An_airplane_engine_running_and_people_talking_mel.npy.npy	<airplane engine running& all>@<people talking& all>
Adult_females_are_laughing,_and_thumping_occurs.wav	audiocaps	Adult females are laughing, and thumping occurs	audio_wav_train/Adult_females_are_laughing,_and_thumping_occurs.wav	10.0	audio_wav_train_mel/Adult_females_are_laughing,_and_thumping_occurs_mel.npy.npy	<adult females laughing& all>@<thumping occurs& all>
A_lady_talking_and_horse_noises.wav	audiocaps	A lady talking and horse noises	audio_wav_train/A_lady_talking_and_horse_noises.wav	10.0	audio_wav_train_mel/A_lady_talking_and_horse_noises_mel.npy.npy	<lady talking& all>@<horse noises& all>
An_adult_female_speaks_and_a_cat_meows.wav	audiocaps	An adult female speaks and a cat meows	audio_wav_train/An_adult_female_speaks_and_a_cat_meows.wav	10.0	audio_wav_train_mel/An_adult_female_speaks_and_a_cat_meows_mel.npy.npy	<adult female speaks& all>@<cat meows& mid>
A_woman_talks_nearby_as_water_pours.wav	audiocaps	A woman talks nearby as water pours	audio_wav_train/A_woman_talks_nearby_as_water_pours.wav	10.0	audio_wav_train_mel/A_woman_talks_nearby_as_water_pours_mel.npy.npy	<woman talks nearby& all>@<water pours& all>
Motorcycle_revving_the_engine.wav	audiocaps	Motorcycle revving the engine	audio_wav_train/Motorcycle_revving_the_engine.wav	10.0	audio_wav_train_mel/Motorcycle_revving_the_engine_mel.npy.npy	<motorcycle revving the engine& all>
High_winds_while_dog_barking.wav	audiocaps	High winds while dog barking	audio_wav_train/High_winds_while_dog_barking.wav	10.0	audio_wav_train_mel/High_winds_while_dog_barking_mel.npy.npy	<high winds& all>@<dog barking& all>
A_water_faucet_pouring_with_a_series_of_water_gurgles_and_splashes_then_water_dripping.wav	audiocaps	A water faucet pouring with a series of water gurgles and splashes then water dripping	audio_wav_train/A_water_faucet_pouring_with_a_series_of_water_gurgles_and_splashes_then_water_dripping.wav	10.0	audio_wav_train_mel/A_water_faucet_pouring_with_a_series_of_water_gurgles_and_splashes_then_water_dripping_mel.npy.npy	<water faucet pouring& all>@<water gurgles& mid>@<water splashes& mid>@<water dripping& end>
A_kid_cries_as_a_man_is_talking_in_the_distance_followed_by_a_man_laughing.wav	audiocaps	A kid cries as a man is talking in the distance followed by a man laughing	audio_wav_train/A_kid_cries_as_a_man_is_talking_in_the_distance_followed_by_a_man_laughing.wav	10.0	audio_wav_train_mel/A_kid_cries_as_a_man_is_talking_in_the_distance_followed_by_a_man_laughing_mel.npy.npy	<kid cries& start>@<man talking in the distance& mid>@<man laughing& end>
A_car_engine_is_revving.wav	audiocaps	A car engine is revving	audio_wav_train/A_car_engine_is_revving.wav	10.0	audio_wav_train_mel/A_car_engine_is_revving_mel.npy.npy	<car engine revving& all>
A_crowd_cheers,_a_man_speaks_to_them.wav	audiocaps	A crowd cheers, a man speaks to them	audio_wav_train/A_crowd_cheers,_a_man_speaks_to_them.wav	10.0	audio_wav_train_mel/A_crowd_cheers,_a_man_speaks_to_them_mel.npy.npy	<crowd cheers& all>@<man speaks to them& all>
Birds_are_flapping_their_wings.wav	audiocaps	Birds are flapping their wings	audio_wav_train/Birds_are_flapping_their_wings.wav	10.0	audio_wav_train_mel/Birds_are_flapping_their_wings_mel.npy.npy	<birds flapping their wings& all>
Humming_of_an_engine_followed_by_a_woman_speaking_and_a_burp.wav	audiocaps	Humming of an engine followed by a woman speaking and a burp	audio_wav_train/Humming_of_an_engine_followed_by_a_woman_speaking_and_a_burp.wav	10.0	audio_wav_train_mel/Humming_of_an_engine_followed_by_a_woman_speaking_and_a_burp_mel.npy.npy	<humming of an engine& all>@<woman speaking& mid>@<burp& end>
Someone_belches_continuously.wav	audiocaps	Someone belches continuously	audio_wav_train/Someone_belches_continuously.wav	10.0	audio_wav_train_mel/Someone_belches_continuously_mel.npy.npy	<someone belches continuously& all>
Loud_vibrations_of_a_car_idling_and_revving,_it_stops.wav	audiocaps	Loud vibrations of a car idling and revving, it stops	audio_wav_train/Loud_vibrations_of_a_car_idling_and_revving,_it_stops.wav	10.0	audio_wav_train_mel/Loud_vibrations_of_a_car_idling_and_revving,_it_stops_mel.npy.npy	<loud vibrations of a car idling and revving& all>@<car stops& end>
Multiple_fire_truck_sirens_going_off_continuously,_then_the_engine_of_a_car_zooms_past.wav	audiocaps	Multiple fire truck sirens going off continuously, then the engine of a car zooms past	audio_wav_train/Multiple_fire_truck_sirens_going_off_continuously,_then_the_engine_of_a_car_zooms_past.wav	10.0	audio_wav_train_mel/Multiple_fire_truck_sirens_going_off_continuously,_then_the_engine_of_a_car_zooms_past_mel.npy.npy	<fire truck sirens& all>@<car engine zooms past& end>
A_man_gives_a_speech_to_a_noisy_crowd.wav	audiocaps	A man gives a speech to a noisy crowd	audio_wav_train/A_man_gives_a_speech_to_a_noisy_crowd.wav	10.0	audio_wav_train_mel/A_man_gives_a_speech_to_a_noisy_crowd_mel.npy.npy	<man gives a speech& all>@<noisy crowd& all>
Mechanical_humming_and_a_faint_ticking_clock.wav	audiocaps	Mechanical humming and a faint ticking clock	audio_wav_train/Mechanical_humming_and_a_faint_ticking_clock.wav	10.0	audio_wav_train_mel/Mechanical_humming_and_a_faint_ticking_clock_mel.npy.npy	<mechanical humming& all>@<faint ticking clock& all>
A_dog_barks_and_a_young_woman_speaks_and_splashes.wav	audiocaps	A dog barks and a young woman speaks and splashes	audio_wav_train/A_dog_barks_and_a_young_woman_speaks_and_splashes.wav	10.0	audio_wav_train_mel/A_dog_barks_and_a_young_woman_speaks_and_splashes_mel.npy.npy	<dog barks& start>@<young woman speaks& mid>@<splashing& end>
Birds_are_chirping_loudly_in_the_background_while_a_male_and_female_are_communicating,_followed_by_another_male_and_female_voice_speaking_out.wav	audiocaps	Birds are chirping loudly in the background while a male and female are communicating, followed by another male and female voice speaking out	audio_wav_train/Birds_are_chirping_loudly_in_the_background_while_a_male_and_female_are_communicating,_followed_by_another_male_and_female_voice_speaking_out.wav	10.0	audio_wav_train_mel/Birds_are_chirping_loudly_in_the_background_while_a_male_and_female_are_communicating,_followed_by_another_male_and_female_voice_speaking_out_mel.npy.npy	<birds chirping loudly& all>@<male voice communicating& start>@<female voice communicating& mid>@<another male voice speaking& mid>@<another female voice speaking& end>
A_duck_quacks_many_times_and_then_a_man_talks_and_a_gunshot_rings_out.wav	audiocaps	A duck quacks many times and then a man talks and a gunshot rings out	audio_wav_train/A_duck_quacks_many_times_and_then_a_man_talks_and_a_gunshot_rings_out.wav	10.0	audio_wav_train_mel/A_duck_quacks_many_times_and_then_a_man_talks_and_a_gunshot_rings_out_mel.npy.npy	<duck quacks many times& start>@<man talks& mid>@<gunshot rings out& end>
The_wind_is_blowing,_a_horse_is_trotting,_and_an_adult_male_speaks.wav	audiocaps	The wind is blowing, a horse is trotting, and an adult male speaks	audio_wav_train/The_wind_is_blowing,_a_horse_is_trotting,_and_an_adult_male_speaks.wav	10.0	audio_wav_train_mel/The_wind_is_blowing,_a_horse_is_trotting,_and_an_adult_male_speaks_mel.npy.npy	<wind blowing& all>@<horse trotting& all>@<adult male speaks& all>
Water_lapping_and_a_male_voice_followed_by_slapping_water_sounds.wav	audiocaps	Water lapping and a male voice followed by slapping water sounds	audio_wav_train/Water_lapping_and_a_male_voice_followed_by_slapping_water_sounds.wav	10.0	audio_wav_train_mel/Water_lapping_and_a_male_voice_followed_by_slapping_water_sounds_mel.npy.npy	<water lapping& all>@<male voice& mid>@<slapping water sounds& end>
A_baby_crying_and_breathing.wav	audiocaps	A baby crying and breathing	audio_wav_train/A_baby_crying_and_breathing.wav	10.0	audio_wav_train_mel/A_baby_crying_and_breathing_mel.npy.npy	<baby crying& all>@<baby breathing& all>
An_airplane_propeller_spins_loudly,_and_then_a_person_bangs_on_a_window_multiple_times.wav	audiocaps	An airplane propeller spins loudly, and then a person bangs on a window multiple times	audio_wav_train/An_airplane_propeller_spins_loudly,_and_then_a_person_bangs_on_a_window_multiple_times.wav	10.0	audio_wav_train_mel/An_airplane_propeller_spins_loudly,_and_then_a_person_bangs_on_a_window_multiple_times_mel.npy.npy	<airplane propeller spins loudly& start>@<person bangs on window& mid>
People_talk_as_goats_bah_repeatedly.wav	audiocaps	People talk as goats bah repeatedly	audio_wav_train/People_talk_as_goats_bah_repeatedly.wav	10.0	audio_wav_train_mel/People_talk_as_goats_bah_repeatedly_mel.npy.npy	<people talk& all>@<goats bah repeatedly& all>
A_race_car_is_speeding_up_very_fast_and_throttling_down.wav	audiocaps	A race car is speeding up very fast and throttling down	audio_wav_train/A_race_car_is_speeding_up_very_fast_and_throttling_down.wav	10.0	audio_wav_train_mel/A_race_car_is_speeding_up_very_fast_and_throttling_down_mel.npy.npy	<race car speeding up& start>@<race car throttling down& end>
Some_clanking,_bids_chirp_in_the_distance.wav	audiocaps	Some clanking, bids chirp in the distance	audio_wav_train/Some_clanking,_bids_chirp_in_the_distance.wav	10.0	audio_wav_train_mel/Some_clanking,_bids_chirp_in_the_distance_mel.npy.npy	<clanking& all>@<birds chirp in the distance& all>
Crackling_noise_precedes_a_fly_buzzing.wav	audiocaps	Crackling noise precedes a fly buzzing	audio_wav_train/Crackling_noise_precedes_a_fly_buzzing.wav	10.0	audio_wav_train_mel/Crackling_noise_precedes_a_fly_buzzing_mel.npy.npy	<crackling noise& start>@<fly buzzing& end>
Clapping,_a_man_speaking.wav	audiocaps	Clapping, a man speaking	audio_wav_train/Clapping,_a_man_speaking.wav	10.0	audio_wav_train_mel/Clapping,_a_man_speaking_mel.npy.npy	<clapping& start>@<man speaking& all>
Metal_clangs_together_followed_by_a_man_speaking.wav	audiocaps	Metal clangs together followed by a man speaking	audio_wav_train/Metal_clangs_together_followed_by_a_man_speaking.wav	10.0	audio_wav_train_mel/Metal_clangs_together_followed_by_a_man_speaking_mel.npy.npy	<metal clangs together& start>@<man speaking& all>
Heavy_wind_and_footsteps.wav	audiocaps	Heavy wind and footsteps	audio_wav_train/Heavy_wind_and_footsteps.wav	10.0	audio_wav_train_mel/Heavy_wind_and_footsteps_mel.npy.npy	<heavy wind& all>@<footsteps& all>
Insects_buzzing_followed_by_a_man_speaking_then_a_woman_speaking.wav	audiocaps	Insects buzzing followed by a man speaking then a woman speaking	audio_wav_train/Insects_buzzing_followed_by_a_man_speaking_then_a_woman_speaking.wav	10.0	audio_wav_train_mel/Insects_buzzing_followed_by_a_man_speaking_then_a_woman_speaking_mel.npy.npy	<insects buzzing& start>@<man speaking& mid>@<woman speaking& end>
Gunshots_are_steadily_shot_as_a_train_is_chugging_and_finally_a_man_moans_and_three_is_a_crash.wav	audiocaps	Gunshots are steadily shot as a train is chugging and finally a man moans and three is a crash	audio_wav_train/Gunshots_are_steadily_shot_as_a_train_is_chugging_and_finally_a_man_moans_and_three_is_a_crash.wav	10.0	audio_wav_train_mel/Gunshots_are_steadily_shot_as_a_train_is_chugging_and_finally_a_man_moans_and_three_is_a_crash_mel.npy.npy	<gunshots& start>@<train chugging& all>@<man moans& mid>@<crash& end>
A_man_is_speaking_and_cars_are_speeding_by.wav	audiocaps	A man is speaking and cars are speeding by	audio_wav_train/A_man_is_speaking_and_cars_are_speeding_by.wav	10.0	audio_wav_train_mel/A_man_is_speaking_and_cars_are_speeding_by_mel.npy.npy	<man speaking& all>@<cars speeding by& all>
A_frog_chirps_and_other_frogs_and_crickets_chirp_in_the_background.wav	audiocaps	A frog chirps and other frogs and crickets chirp in the background	audio_wav_train/A_frog_chirps_and_other_frogs_and_crickets_chirp_in_the_background.wav	10.0	audio_wav_train_mel/A_frog_chirps_and_other_frogs_and_crickets_chirp_in_the_background_mel.npy.npy	<frog chirps& all>@<other frogs chirp& all>@<crickets chirp& all>
An_engine_trying_to_start.wav	audiocaps	An engine trying to start	audio_wav_train/An_engine_trying_to_start.wav	10.0	audio_wav_train_mel/An_engine_trying_to_start_mel.npy.npy	<engine trying to start& all>
A_woman_speaking,_a_sewing_machine_working.wav	audiocaps	A woman speaking, a sewing machine working	audio_wav_train/A_woman_speaking,_a_sewing_machine_working.wav	10.0	audio_wav_train_mel/A_woman_speaking,_a_sewing_machine_working_mel.npy.npy	<woman speaking& all>@<sewing machine working& all>
