name	dataset	caption	audio_path	duration	mel_path	struct_cap
Thunderclap_with_car_alarms_blaring_in_the_distance.wav	audiocaps	Thunderclap with car alarms blaring in the distance	audio_wav_train/Thunderclap_with_car_alarms_blaring_in_the_distance.wav	10.0	audio_wav_train_mel/Thunderclap_with_car_alarms_blaring_in_the_distance_mel.npy.npy	<thunderclap& start>@<car alarms blaring& all>
A_man_burps_and_a_baby_cries_then_a_woman_speaks.wav	audiocaps	A man burps and a baby cries then a woman speaks	audio_wav_train/A_man_burps_and_a_baby_cries_then_a_woman_speaks.wav	10.0	audio_wav_train_mel/A_man_burps_and_a_baby_cries_then_a_woman_speaks_mel.npy.npy	<man burps& start>@<baby cries& mid>@<woman speaks& end>
Multiple_bells_ringing_male_voice_distant_in_background.wav	audiocaps	Multiple bells ringing male voice distant in background	audio_wav_train/Multiple_bells_ringing_male_voice_distant_in_background.wav	10.0	audio_wav_train_mel/Multiple_bells_ringing_male_voice_distant_in_background_mel.npy.npy	<multiple bells ringing& all>@<male voice distant in background& all>
Metal_clangs_together_in_an_enclosed_space.wav	audiocaps	Metal clangs together in an enclosed space	audio_wav_train/Metal_clangs_together_in_an_enclosed_space.wav	10.0	audio_wav_train_mel/Metal_clangs_together_in_an_enclosed_space_mel.npy.npy	<metal clangs together& all>
Musical_chimes_are_sounding.wav	audiocaps	Musical chimes are sounding	audio_wav_train/Musical_chimes_are_sounding.wav	10.0	audio_wav_train_mel/Musical_chimes_are_sounding_mel.npy.npy	<musical chimes are sounding& all>
A_small_tool_motor_buzzes_and_an_adult_male_speaks.wav	audiocaps	A small tool motor buzzes and an adult male speaks	audio_wav_train/A_small_tool_motor_buzzes_and_an_adult_male_speaks.wav	10.0	audio_wav_train_mel/A_small_tool_motor_buzzes_and_an_adult_male_speaks_mel.npy.npy	<small tool motor buzzes& all>@<adult male speaks& all>
People_speak,_some_splashing_and_clapping_followed_by_laughing.wav	audiocaps	People speak, some splashing and clapping followed by laughing	audio_wav_train/People_speak,_some_splashing_and_clapping_followed_by_laughing.wav	10.0	audio_wav_train_mel/People_speak,_some_splashing_and_clapping_followed_by_laughing_mel.npy.npy	<people speak& all>@<splashing and clapping& mid>@<laughing& end>
An_object_is_clicking.wav	audiocaps	An object is clicking	audio_wav_train/An_object_is_clicking.wav	10.0	audio_wav_train_mel/An_object_is_clicking_mel.npy.npy	<clicking sound& all>
A_man_laughs_and_a_baby_cries_with_sounds_of_other_people_talking_in_the_background.wav	audiocaps	A man laughs and a baby cries with sounds of other people talking in the background	audio_wav_train/A_man_laughs_and_a_baby_cries_with_sounds_of_other_people_talking_in_the_background.wav	10.0	audio_wav_train_mel/A_man_laughs_and_a_baby_cries_with_sounds_of_other_people_talking_in_the_background_mel.npy.npy	<man laughs& all>@<baby cries& mid>@<sounds of other people talking& all>
An_adult_talks,_and_then_children_talk_and_laugh_as_a_pig_oinks_nearby.wav	audiocaps	An adult talks, and then children talk and laugh as a pig oinks nearby	audio_wav_train/An_adult_talks,_and_then_children_talk_and_laugh_as_a_pig_oinks_nearby.wav	10.0	audio_wav_train_mel/An_adult_talks,_and_then_children_talk_and_laugh_as_a_pig_oinks_nearby_mel.npy.npy	<adult talks& all>@<children talk and laugh& mid>@<pig oinks& end>
Flushing_toilets_then_rapid_tapping.wav	audiocaps	Flushing toilets then rapid tapping	audio_wav_train/Flushing_toilets_then_rapid_tapping.wav	10.0	audio_wav_train_mel/Flushing_toilets_then_rapid_tapping_mel.npy.npy	<flushing toilets& all>@<rapid tapping& end>
A_fan_runs_while_something_rattles.wav	audiocaps	A fan runs while something rattles	audio_wav_train/A_fan_runs_while_something_rattles.wav	10.0	audio_wav_train_mel/A_fan_runs_while_something_rattles_mel.npy.npy	<fan runs& all>@<something rattles& all>
An_aircraft_flies_far_away.wav	audiocaps	An aircraft flies far away	audio_wav_train/An_aircraft_flies_far_away.wav	10.0	audio_wav_train_mel/An_aircraft_flies_far_away_mel.npy.npy	<aircraft flies far away& all>
A_woman_addressing_a_screaming_crowd.wav	audiocaps	A woman addressing a screaming crowd	audio_wav_train/A_woman_addressing_a_screaming_crowd.wav	10.0	audio_wav_train_mel/A_woman_addressing_a_screaming_crowd_mel.npy.npy	<woman addressing a screaming crowd& all>
People_talks_nearby_as_music_plays,_and_then_a_person_talks_closer_nearby.wav	audiocaps	People talks nearby as music plays, and then a person talks closer nearby	audio_wav_train/People_talks_nearby_as_music_plays,_and_then_a_person_talks_closer_nearby.wav	10.0	audio_wav_train_mel/People_talks_nearby_as_music_plays,_and_then_a_person_talks_closer_nearby_mel.npy.npy	<people talk nearby& all>@<music plays& all>@<person talks closer nearby& end>
Something_is_tapped_several_times_followed_by_a_gun_being_shot_several_times.wav	audiocaps	Something is tapped several times followed by a gun being shot several times	audio_wav_train/Something_is_tapped_several_times_followed_by_a_gun_being_shot_several_times.wav	10.0	audio_wav_train_mel/Something_is_tapped_several_times_followed_by_a_gun_being_shot_several_times_mel.npy.npy	<something tapped several times& all>@<gun shot several times& start>
Continuous_snoring.wav	audiocaps	Continuous snoring	audio_wav_train/Continuous_snoring.wav	10.0	audio_wav_train_mel/Continuous_snoring_mel.npy.npy	<continuous snoring& all>
Young_child_crying_and_woman_speaking.wav	audiocaps	Young child crying and woman speaking	audio_wav_train/Young_child_crying_and_woman_speaking.wav	10.0	audio_wav_train_mel/Young_child_crying_and_woman_speaking_mel.npy.npy	<young child crying& all>@<woman speaking& all>
Car_engine_revving_and_accelerating_hard.wav	audiocaps	Car engine revving and accelerating hard	audio_wav_train/Car_engine_revving_and_accelerating_hard.wav	10.0	audio_wav_train_mel/Car_engine_revving_and_accelerating_hard_mel.npy.npy	<car engine revving& all>@<accelerating hard& all>
Two_men_talk_nearby.wav	audiocaps	Two men talk nearby	audio_wav_train/Two_men_talk_nearby.wav	10.0	audio_wav_train_mel/Two_men_talk_nearby_mel.npy.npy	<men talk& all>
People_laughing_and_a_male_voice_speaking.wav	audiocaps	People laughing and a male voice speaking	audio_wav_train/People_laughing_and_a_male_voice_speaking.wav	10.0	audio_wav_train_mel/People_laughing_and_a_male_voice_speaking_mel.npy.npy	<people laughing& all>@<male voice speaking& all>
Mechanical_humming_and_light_rattling.wav	audiocaps	Mechanical humming and light rattling	audio_wav_train/Mechanical_humming_and_light_rattling.wav	10.0	audio_wav_train_mel/Mechanical_humming_and_light_rattling_mel.npy.npy	<mechanical humming& all>@<light rattling& all>
A_helicopter_is_in_use_and_people_are_talking.wav	audiocaps	A helicopter is in use and people are talking	audio_wav_train/A_helicopter_is_in_use_and_people_are_talking.wav	10.0	audio_wav_train_mel/A_helicopter_is_in_use_and_people_are_talking_mel.npy.npy	<helicopter in use& all>@<people talking& all>
Someone_burps_and_a_kid_speaks.wav	audiocaps	Someone burps and a kid speaks	audio_wav_train/Someone_burps_and_a_kid_speaks.wav	10.0	audio_wav_train_mel/Someone_burps_and_a_kid_speaks_mel.npy.npy	<someone burps& start>@<kid speaks& end>
A_person_talking_and_filing_something.wav	audiocaps	A person talking and filing something	audio_wav_train/A_person_talking_and_filing_something.wav	10.0	audio_wav_train_mel/A_person_talking_and_filing_something_mel.npy.npy	<person talking& all>@<filing sound& all>
A_young_male_making_noises_and_an_infant_cooing_followed_by_brief_laughter.wav	audiocaps	A young male making noises and an infant cooing followed by brief laughter	audio_wav_train/A_young_male_making_noises_and_an_infant_cooing_followed_by_brief_laughter.wav	10.0	audio_wav_train_mel/A_young_male_making_noises_and_an_infant_cooing_followed_by_brief_laughter_mel.npy.npy	<young male making noises& all>@<infant cooing& mid>@<brief laughter& end>
A_man_talks_followed_by_several_people_cheering.wav	audiocaps	A man talks followed by several people cheering	audio_wav_train/A_man_talks_followed_by_several_people_cheering.wav	10.0	audio_wav_train_mel/A_man_talks_followed_by_several_people_cheering_mel.npy.npy	<male voice talks& all>@<people cheering& mid>
People_speak_while_a_pig_oinks.wav	audiocaps	People speak while a pig oinks	audio_wav_train/People_speak_while_a_pig_oinks.wav	10.0	audio_wav_train_mel/People_speak_while_a_pig_oinks_mel.npy.npy	<people speak& all>@<pig oinks& mid>
A_door_closes,_and_a_man_talks.wav	audiocaps	A door closes, and a man talks	audio_wav_train/A_door_closes,_and_a_man_talks.wav	10.0	audio_wav_train_mel/A_door_closes,_and_a_man_talks_mel.npy.npy	<door closes& start>@<man talks& all>
Water_is_running_and_splashing,_and_an_adult_male_speaks.wav	audiocaps	Water is running and splashing, and an adult male speaks	audio_wav_train/Water_is_running_and_splashing,_and_an_adult_male_speaks.wav	10.0	audio_wav_train_mel/Water_is_running_and_splashing,_and_an_adult_male_speaks_mel.npy.npy	<water running and splashing& all>@<adult male speaks& all>
Water_runs,_a_cat_groans_angrily.wav	audiocaps	Water runs, a cat groans angrily	audio_wav_train/Water_runs,_a_cat_groans_angrily.wav	10.0	audio_wav_train_mel/Water_runs,_a_cat_groans_angrily_mel.npy.npy	<water runs& all>@<cat groans angrily& all>
A_child_speaks_over_loud_thudding_sounds.wav	audiocaps	A child speaks over loud thudding sounds	audio_wav_train/A_child_speaks_over_loud_thudding_sounds.wav	10.0	audio_wav_train_mel/A_child_speaks_over_loud_thudding_sounds_mel.npy.npy	<child speaks& all>@<loud thudding sounds& all>
Water_running_followed_by_wind.wav	audiocaps	Water running followed by wind	audio_wav_train/Water_running_followed_by_wind.wav	10.0	audio_wav_train_mel/Water_running_followed_by_wind_mel.npy.npy	<water running& all>@<wind& end>
A_tool_is_drilling.wav	audiocaps	A tool is drilling	audio_wav_train/A_tool_is_drilling.wav	10.0	audio_wav_train_mel/A_tool_is_drilling_mel.npy.npy	<tool is drilling& all>
A_man_talking_as_birds_chirp_in_the_background_followed_by_a_train_horn_blowing.wav	audiocaps	A man talking as birds chirp in the background followed by a train horn blowing	audio_wav_train/A_man_talking_as_birds_chirp_in_the_background_followed_by_a_train_horn_blowing.wav	10.0	audio_wav_train_mel/A_man_talking_as_birds_chirp_in_the_background_followed_by_a_train_horn_blowing_mel.npy.npy	<man talking& all>@<birds chirp& mid>@<train horn blowing& end>
An_older_man_is_giving_a_speech.wav	audiocaps	An older man is giving a speech	audio_wav_train/An_older_man_is_giving_a_speech.wav	10.0	audio_wav_train_mel/An_older_man_is_giving_a_speech_mel.npy.npy	<older man giving a speech& all>
Water_trickling_for_a_brief_period.wav	audiocaps	Water trickling for a brief period	audio_wav_train/Water_trickling_for_a_brief_period.wav	10.0	audio_wav_train_mel/Water_trickling_for_a_brief_period_mel.npy.npy	<water trickling& all>
Bird_flying_sounds,_followed_by_a_robotic_voice,_and_then_the_bird_chirping_and_then_a_popping_sound.wav	audiocaps	Bird flying sounds, followed by a robotic voice, and then the bird chirping and then a popping sound	audio_wav_train/Bird_flying_sounds,_followed_by_a_robotic_voice,_and_then_the_bird_chirping_and_then_a_popping_sound.wav	10.0	audio_wav_train_mel/Bird_flying_sounds,_followed_by_a_robotic_voice,_and_then_the_bird_chirping_and_then_a_popping_sound_mel.npy.npy	<bird flying sounds& start>@<robotic voice& mid>@<bird chirping& mid>@<popping sound& end>
A_car_drives_consistently.wav	audiocaps	A car drives consistently	audio_wav_train/A_car_drives_consistently.wav	10.0	audio_wav_train_mel/A_car_drives_consistently_mel.npy.npy	<car drives consistently& all>
Peaceful_winds_with_the_sounds_of_chirping_birds_in_the_distance.wav	audiocaps	Peaceful winds with the sounds of chirping birds in the distance	audio_wav_train/Peaceful_winds_with_the_sounds_of_chirping_birds_in_the_distance.wav	10.0	audio_wav_train_mel/Peaceful_winds_with_the_sounds_of_chirping_birds_in_the_distance_mel.npy.npy	<peaceful winds& all>@<chirping birds& all>
Sizzling_is_present,_metal_clinking_occurs,_an_adult_male_speaks,_liquid_pours_and_gurgles,_and_a_thump_occurs.wav	audiocaps	Sizzling is present, metal clinking occurs, an adult male speaks, liquid pours and gurgles, and a thump occurs	audio_wav_train/Sizzling_is_present,_metal_clinking_occurs,_an_adult_male_speaks,_liquid_pours_and_gurgles,_and_a_thump_occurs.wav	10.0	audio_wav_train_mel/Sizzling_is_present,_metal_clinking_occurs,_an_adult_male_speaks,_liquid_pours_and_gurgles,_and_a_thump_occurs_mel.npy.npy	<sizzling& all>@<metal clinking& mid>@<adult male speaks& all>@<liquid pours and gurgles& mid>@<thump& end>
A_woman_speaks_to_a_crowd,_some_camera_clicks.wav	audiocaps	A woman speaks to a crowd, some camera clicks	audio_wav_train/A_woman_speaks_to_a_crowd,_some_camera_clicks.wav	10.0	audio_wav_train_mel/A_woman_speaks_to_a_crowd,_some_camera_clicks_mel.npy.npy	<woman speaks to a crowd& all>@<camera clicks& mid>
Motorcyle_vehicle_revving_down.wav	audiocaps	Motorcyle vehicle revving down	audio_wav_train/Motorcyle_vehicle_revving_down.wav	10.0	audio_wav_train_mel/Motorcyle_vehicle_revving_down_mel.npy.npy	<motorcycle revving& all>>
Deep_laughing_followed_by_a_cat_meowing_and_a_man_speaking.wav	audiocaps	Deep laughing followed by a cat meowing and a man speaking	audio_wav_train/Deep_laughing_followed_by_a_cat_meowing_and_a_man_speaking.wav	10.0	audio_wav_train_mel/Deep_laughing_followed_by_a_cat_meowing_and_a_man_speaking_mel.npy.npy	<deep laughing& start>@<cat meowing& mid>@<man speaking& end>
A_jet_engine_runs_steadily.wav	audiocaps	A jet engine runs steadily	audio_wav_train/A_jet_engine_runs_steadily.wav	10.0	audio_wav_train_mel/A_jet_engine_runs_steadily_mel.npy.npy	<jet engine runs steadily& all>
Machine_is_sawing_wood.wav	audiocaps	Machine is sawing wood	audio_wav_train/Machine_is_sawing_wood.wav	10.0	audio_wav_train_mel/Machine_is_sawing_wood_mel.npy.npy	<machine is sawing wood& all>
Clanking_with_brief_speech.wav	audiocaps	Clanking with brief speech	audio_wav_train/Clanking_with_brief_speech.wav	10.0	audio_wav_train_mel/Clanking_with_brief_speech_mel.npy.npy	<clanking& all>@<brief speech& mid>
Soft_music_and_banging_in_the_background.wav	audiocaps	Soft music and banging in the background	audio_wav_train/Soft_music_and_banging_in_the_background.wav	10.0	audio_wav_train_mel/Soft_music_and_banging_in_the_background_mel.npy.npy	<soft music& all>@<banging in the background& all>
A_baby_cries_and_laughs_as_people_speak.wav	audiocaps	A baby cries and laughs as people speak	audio_wav_train/A_baby_cries_and_laughs_as_people_speak.wav	10.0	audio_wav_train_mel/A_baby_cries_and_laughs_as_people_speak_mel.npy.npy	<people speak& all>@<baby cries& start>@<baby laughs& mid>
An_engine_with_squealing_brakes_followed_by_a_siren_passing.wav	audiocaps	An engine with squealing brakes followed by a siren passing	audio_wav_train/An_engine_with_squealing_brakes_followed_by_a_siren_passing.wav	10.0	audio_wav_train_mel/An_engine_with_squealing_brakes_followed_by_a_siren_passing_mel.npy.npy	<engine with squealing brakes& start>@<siren passing& mid>
Someone_snores_briefly.wav	audiocaps	Someone snores briefly	audio_wav_train/Someone_snores_briefly.wav	10.0	audio_wav_train_mel/Someone_snores_briefly_mel.npy.npy	<someone snores& all>
The_wind_is_blowing,_a_railroad_crossing_alarm_clangs_in_the_distance,_and_a_train_horn_blows.wav	audiocaps	The wind is blowing, a railroad crossing alarm clangs in the distance, and a train horn blows	audio_wav_train/The_wind_is_blowing,_a_railroad_crossing_alarm_clangs_in_the_distance,_and_a_train_horn_blows.wav	10.0	audio_wav_train_mel/The_wind_is_blowing,_a_railroad_crossing_alarm_clangs_in_the_distance,_and_a_train_horn_blows_mel.npy.npy	<wind blowing& all>@<railroad crossing alarm clangs& mid>@<train horn blows& end>
White_noise_and_rustling_with_a_distant_speech_followed_by_beeps.wav	audiocaps	White noise and rustling with a distant speech followed by beeps	audio_wav_train/White_noise_and_rustling_with_a_distant_speech_followed_by_beeps.wav	10.0	audio_wav_train_mel/White_noise_and_rustling_with_a_distant_speech_followed_by_beeps_mel.npy.npy	<white noise and rustling& all>@<distant speech& mid>@<beeps& end>
A_horse_clip-clops_nearby_and_then_stops.wav	audiocaps	A horse clip-clops nearby and then stops	audio_wav_train/A_horse_clip-clops_nearby_and_then_stops.wav	10.0	audio_wav_train_mel/A_horse_clip-clops_nearby_and_then_stops_mel.npy.npy	<horse clip-clops nearby& start>@<stops& end>
Ocean_waves_crashing_as_footsteps_run_on_sand_followed_by_dogs_barking_while_wind_blows_into_a_microphone.wav	audiocaps	Ocean waves crashing as footsteps run on sand followed by dogs barking while wind blows into a microphone	audio_wav_train/Ocean_waves_crashing_as_footsteps_run_on_sand_followed_by_dogs_barking_while_wind_blows_into_a_microphone.wav	10.0	audio_wav_train_mel/Ocean_waves_crashing_as_footsteps_run_on_sand_followed_by_dogs_barking_while_wind_blows_into_a_microphone_mel.npy.npy	<ocean waves crashing& all>@<footsteps run on sand& start>@<dogs barking& mid>@<wind blows into microphone& end>
Something_pops_a_few_times_while_in_the_background_there_is_a_low_hum_followed_by_two_gunshots.wav	audiocaps	Something pops a few times while in the background there is a low hum followed by two gunshots	audio_wav_train/Something_pops_a_few_times_while_in_the_background_there_is_a_low_hum_followed_by_two_gunshots.wav	10.0	audio_wav_train_mel/Something_pops_a_few_times_while_in_the_background_there_is_a_low_hum_followed_by_two_gunshots_mel.npy.npy	<something pops& all>@<low hum& all>@<gunshot& mid>@<gunshot& end>
High_pitched_screeching_and_spraying_with_people_speaking.wav	audiocaps	High pitched screeching and spraying with people speaking	audio_wav_train/High_pitched_screeching_and_spraying_with_people_speaking.wav	10.0	audio_wav_train_mel/High_pitched_screeching_and_spraying_with_people_speaking_mel.npy.npy	<high pitched screeching& all>@<spraying& all>@<people speaking& all>
After_a_loud_horn_the_gates_ding_and_go_down_as_a_train_is_coming_down_the_track.wav	audiocaps	After a loud horn the gates ding and go down as a train is coming down the track	audio_wav_train/After_a_loud_horn_the_gates_ding_and_go_down_as_a_train_is_coming_down_the_track.wav	10.0	audio_wav_train_mel/After_a_loud_horn_the_gates_ding_and_go_down_as_a_train_is_coming_down_the_track_mel.npy.npy	<loud horn& start>@<gates ding& mid>@<train approaching& all>
A_toy_helicopter_engine_starting_up_then_flying.wav	audiocaps	A toy helicopter engine starting up then flying	audio_wav_train/A_toy_helicopter_engine_starting_up_then_flying.wav	10.0	audio_wav_train_mel/A_toy_helicopter_engine_starting_up_then_flying_mel.npy.npy	<toy helicopter engine starting up& start>@<toy helicopter flying& mid>
People_burping_loudly.wav	audiocaps	People burping loudly	audio_wav_train/People_burping_loudly.wav	10.0	audio_wav_train_mel/People_burping_loudly_mel.npy.npy	<people burping loudly& all>
Buzzing_of_a_bug,_birds_chirping.wav	audiocaps	Buzzing of a bug, birds chirping	audio_wav_train/Buzzing_of_a_bug,_birds_chirping.wav	10.0	audio_wav_train_mel/Buzzing_of_a_bug,_birds_chirping_mel.npy.npy	<buzzing of a bug& all>@<birds chirping& all>
Distressed_animal_panting_with_woman_speaking_in_background.wav	audiocaps	Distressed animal panting with woman speaking in background	audio_wav_train/Distressed_animal_panting_with_woman_speaking_in_background.wav	10.0	audio_wav_train_mel/Distressed_animal_panting_with_woman_speaking_in_background_mel.npy.npy	<distressed animal panting& all>@<woman speaking& all>
A_child_speaks_and_water_runs.wav	audiocaps	A child speaks and water runs	audio_wav_train/A_child_speaks_and_water_runs.wav	10.0	audio_wav_train_mel/A_child_speaks_and_water_runs_mel.npy.npy	<child speaks& all>@<water runs& all>
A_very_loud_engine_accelerating.wav	audiocaps	A very loud engine accelerating	audio_wav_train/A_very_loud_engine_accelerating.wav	10.0	audio_wav_train_mel/A_very_loud_engine_accelerating_mel.npy.npy	<very loud engine accelerating& all>
A_man_is_talking_and_a_whoosh_is_heard.wav	audiocaps	A man is talking and a whoosh is heard	audio_wav_train/A_man_is_talking_and_a_whoosh_is_heard.wav	10.0	audio_wav_train_mel/A_man_is_talking_and_a_whoosh_is_heard_mel.npy.npy	<man talking& all>@<whoosh& mid>
A_person_kissing_and_a_baby_laughing.wav	audiocaps	A person kissing and a baby laughing	audio_wav_train/A_person_kissing_and_a_baby_laughing.wav	10.0	audio_wav_train_mel/A_person_kissing_and_a_baby_laughing_mel.npy.npy	<person kisses& all>@<baby laughs& all>
A_person_talks_and_a_bird_chirps_and_whistles.wav	audiocaps	A person talks and a bird chirps and whistles	audio_wav_train/A_person_talks_and_a_bird_chirps_and_whistles.wav	10.0	audio_wav_train_mel/A_person_talks_and_a_bird_chirps_and_whistles_mel.npy.npy	<person talks& all>@<bird chirps& start>@<bird whistles& mid>
A_man_talking_before_shouting_then_whistling_followed_by_rustling.wav	audiocaps	A man talking before shouting then whistling followed by rustling	audio_wav_train/A_man_talking_before_shouting_then_whistling_followed_by_rustling.wav	10.0	audio_wav_train_mel/A_man_talking_before_shouting_then_whistling_followed_by_rustling_mel.npy.npy	<male voice talking& all>@<shouting& mid>@<whistling& mid>@<rustling& end>
A_man_speaking_with_people_clapping.wav	audiocaps	A man speaking with people clapping	audio_wav_train/A_man_speaking_with_people_clapping.wav	10.0	audio_wav_train_mel/A_man_speaking_with_people_clapping_mel.npy.npy	<man speaking& all>@<people clapping& all>
A_helicopter_propellers_spinning.wav	audiocaps	A helicopter propellers spinning	audio_wav_train/A_helicopter_propellers_spinning.wav	10.0	audio_wav_train_mel/A_helicopter_propellers_spinning_mel.npy.npy	<helicopter propellers spinning& all>
Loud_continuous_hissing.wav	audiocaps	Loud continuous hissing	audio_wav_train/Loud_continuous_hissing.wav	10.0	audio_wav_train_mel/Loud_continuous_hissing_mel.npy.npy	<loud continuous hissing& all>
Rustling_and_sizzling.wav	audiocaps	Rustling and sizzling	audio_wav_train/Rustling_and_sizzling.wav	10.0	audio_wav_train_mel/Rustling_and_sizzling_mel.npy.npy	<rustling& all>@<sizzling& all>
Engine_running_followed_by_speech.wav	audiocaps	Engine running followed by speech	audio_wav_train/Engine_running_followed_by_speech.wav	10.0	audio_wav_train_mel/Engine_running_followed_by_speech_mel.npy.npy	<engine running& all>@<speech& end>
Clanking_followed_by_a_toilet_flushing_and_then_some_more_clanking.wav	audiocaps	Clanking followed by a toilet flushing and then some more clanking	audio_wav_train/Clanking_followed_by_a_toilet_flushing_and_then_some_more_clanking.wav	10.0	audio_wav_train_mel/Clanking_followed_by_a_toilet_flushing_and_then_some_more_clanking_mel.npy.npy	<clanking& start>@<toilet flushing& mid>@<more clanking& end>
A_long_beep_sounds_then_an_engine_starts_and_another_beep_happens.wav	audiocaps	A long beep sounds then an engine starts and another beep happens	audio_wav_train/A_long_beep_sounds_then_an_engine_starts_and_another_beep_happens.wav	10.0	audio_wav_train_mel/A_long_beep_sounds_then_an_engine_starts_and_another_beep_happens_mel.npy.npy	<long beep& start>@<engine starts& mid>@<another beep& end>
A_man_talks_while_different_birds_tweet.wav	audiocaps	A man talks while different birds tweet	audio_wav_train/A_man_talks_while_different_birds_tweet.wav	10.0	audio_wav_train_mel/A_man_talks_while_different_birds_tweet_mel.npy.npy	<man talks& all>@<birds tweet& all>
A_gurgling_stream.wav	audiocaps	A gurgling stream	audio_wav_train/A_gurgling_stream.wav	10.0	audio_wav_train_mel/A_gurgling_stream_mel.npy.npy	<gurgling stream& all>
An_engine_accelerating_away_and_heavy_wind.wav	audiocaps	An engine accelerating away and heavy wind	audio_wav_train/An_engine_accelerating_away_and_heavy_wind.wav	10.0	audio_wav_train_mel/An_engine_accelerating_away_and_heavy_wind_mel.npy.npy	<engine accelerating away& all>@<heavy wind& all>
A_man_speaks_into_a_microphone,_a_guitar_plays,_the_audience_laughs,_and_then_a_woman_speaks.wav	audiocaps	A man speaks into a microphone, a guitar plays, the audience laughs, and then a woman speaks	audio_wav_train/A_man_speaks_into_a_microphone,_a_guitar_plays,_the_audience_laughs,_and_then_a_woman_speaks.wav	10.0	audio_wav_train_mel/A_man_speaks_into_a_microphone,_a_guitar_plays,_the_audience_laughs,_and_then_a_woman_speaks_mel.npy.npy	<man speaks into a microphone& all>@<guitar plays& all>@<audience laughs& mid>@<woman speaks& end>
A_race_car_is_driving_as_a_man_talks.wav	audiocaps	A race car is driving as a man talks	audio_wav_train/A_race_car_is_driving_as_a_man_talks.wav	10.0	audio_wav_train_mel/A_race_car_is_driving_as_a_man_talks_mel.npy.npy	<male voice talking& all>@<race car driving& all>
A_child_screaming_and_crying,_and_a_woman_talking.wav	audiocaps	A child screaming and crying, and a woman talking	audio_wav_train/A_child_screaming_and_crying,_and_a_woman_talking.wav	10.0	audio_wav_train_mel/A_child_screaming_and_crying,_and_a_woman_talking_mel.npy.npy	<child screaming and crying& all>@<woman talking& all>
A_man_speaking_is_followed_by_an_irritated_yawn_and_people_talking.wav	audiocaps	A man speaking is followed by an irritated yawn and people talking	audio_wav_train/A_man_speaking_is_followed_by_an_irritated_yawn_and_people_talking.wav	10.0	audio_wav_train_mel/A_man_speaking_is_followed_by_an_irritated_yawn_and_people_talking_mel.npy.npy	<man speaking& all>@<irritated yawn& mid>@<people talking& end>
A_soft_trumpet_then_a_whir_and_a_bubbling_electric_sound.wav	audiocaps	A soft trumpet then a whir and a bubbling electric sound	audio_wav_train/A_soft_trumpet_then_a_whir_and_a_bubbling_electric_sound.wav	10.0	audio_wav_train_mel/A_soft_trumpet_then_a_whir_and_a_bubbling_electric_sound_mel.npy.npy	<soft trumpet& start>@<whir& mid>@<bubbling electric sound& end>
