name	dataset	caption	audio_path	duration	mel_path	struct_cap
Human_speech_with_a_duck_softly_quacking.wav	audiocaps	Human speech with a duck softly quacking	audio_wav_train/Human_speech_with_a_duck_softly_quacking.wav	10.0	audio_wav_train_mel/Human_speech_with_a_duck_softly_quacking_mel.npy.npy	<human speech& all>@<duck softly quacking& all>
Whimpering_and_then_water_running.wav	audiocaps	Whimpering and then water running	audio_wav_train/Whimpering_and_then_water_running.wav	10.0	audio_wav_train_mel/Whimpering_and_then_water_running_mel.npy.npy	<whimpering& start>@<water running& all>
Birds_tweet_while_a_ball_is_played.wav	audiocaps	Birds tweet while a ball is played	audio_wav_train/Birds_tweet_while_a_ball_is_played.wav	10.0	audio_wav_train_mel/Birds_tweet_while_a_ball_is_played_mel.npy.npy	<birds tweet& all>@<ball is played& all>
A_train_clatters_by_on_a_track_and_then_honks_blare_and_fade_in_the_background.wav	audiocaps	A train clatters by on a track and then honks blare and fade in the background	audio_wav_train/A_train_clatters_by_on_a_track_and_then_honks_blare_and_fade_in_the_background.wav	10.0	audio_wav_train_mel/A_train_clatters_by_on_a_track_and_then_honks_blare_and_fade_in_the_background_mel.npy.npy	<train clatters by on a track& start>@<honks blare& mid>@<fade in the background& end>
Motor_along_with_gurgling.wav	audiocaps	Motor along with gurgling	audio_wav_train/Motor_along_with_gurgling.wav	10.0	audio_wav_train_mel/Motor_along_with_gurgling_mel.npy.npy	<motor sound& all>@<gurgling& all>
Train_going_by_blowing_horn.wav	audiocaps	Train going by blowing horn	audio_wav_train/Train_going_by_blowing_horn.wav	10.0	audio_wav_train_mel/Train_going_by_blowing_horn_mel.npy.npy	<train going by& all>@<blowing horn& all>
Someone_snores_followed_by_a_woman_talking.wav	audiocaps	Someone snores followed by a woman talking	audio_wav_train/Someone_snores_followed_by_a_woman_talking.wav	10.0	audio_wav_train_mel/Someone_snores_followed_by_a_woman_talking_mel.npy.npy	<someone snores& start>@<woman talking& all>
Wind_is_blowing_and_woman_is_laughing.wav	audiocaps	Wind is blowing and woman is laughing	audio_wav_train/Wind_is_blowing_and_woman_is_laughing.wav	10.0	audio_wav_train_mel/Wind_is_blowing_and_woman_is_laughing_mel.npy.npy	<wind blowing& all>@<woman laughing& all>
A_woman_speaking,_followed_by_a_group_of_people_responding_by_laughing_in_unison.wav	audiocaps	A woman speaking, followed by a group of people responding by laughing in unison	audio_wav_train/A_woman_speaking,_followed_by_a_group_of_people_responding_by_laughing_in_unison.wav	10.0	audio_wav_train_mel/A_woman_speaking,_followed_by_a_group_of_people_responding_by_laughing_in_unison_mel.npy.npy	<woman speaking& start>@<group laughs in unison& end>
Bells_ring_as_sheep_bleat_and_a_man_speaks.wav	audiocaps	Bells ring as sheep bleat and a man speaks	audio_wav_train/Bells_ring_as_sheep_bleat_and_a_man_speaks.wav	10.0	audio_wav_train_mel/Bells_ring_as_sheep_bleat_and_a_man_speaks_mel.npy.npy	<bells ring& all>@<sheep bleat& all>@<man speaks& all>
A_man_speaks_as_a_clock_ticks_and_plastic_crinkles.wav	audiocaps	A man speaks as a clock ticks and plastic crinkles	audio_wav_train/A_man_speaks_as_a_clock_ticks_and_plastic_crinkles.wav	10.0	audio_wav_train_mel/A_man_speaks_as_a_clock_ticks_and_plastic_crinkles_mel.npy.npy	<male voice speaks& all>@<clock ticks& all>@<plastic crinkles& all>
A_dog_pants,_a_horn_blows,_and_the_dog_barks.wav	audiocaps	A dog pants, a horn blows, and the dog barks	audio_wav_train/A_dog_pants,_a_horn_blows,_and_the_dog_barks.wav	10.0	audio_wav_train_mel/A_dog_pants,_a_horn_blows,_and_the_dog_barks_mel.npy.npy	<dog pants& all>@<horn blows& mid>@<dog barks& end>
An_aircraft_engine_running.wav	audiocaps	An aircraft engine running	audio_wav_train/An_aircraft_engine_running.wav	10.0	audio_wav_train_mel/An_aircraft_engine_running_mel.npy.npy	<aircraft engine running& all>
A_vehicle_engine_running_then_revving_as_an_air_horn_blows_several_times.wav	audiocaps	A vehicle engine running then revving as an air horn blows several times	audio_wav_train/A_vehicle_engine_running_then_revving_as_an_air_horn_blows_several_times.wav	10.0	audio_wav_train_mel/A_vehicle_engine_running_then_revving_as_an_air_horn_blows_several_times_mel.npy.npy	<vehicle engine running& all>@<engine revving& mid>@<air horn blows& end>
A_machine_motor_humming_then_powering_off_alongside_pressurized_air_releasing_several_times_followed_by_metal_clanking.wav	audiocaps	A machine motor humming then powering off alongside pressurized air releasing several times followed by metal clanking	audio_wav_train/A_machine_motor_humming_then_powering_off_alongside_pressurized_air_releasing_several_times_followed_by_metal_clanking.wav	10.0	audio_wav_train_mel/A_machine_motor_humming_then_powering_off_alongside_pressurized_air_releasing_several_times_followed_by_metal_clanking_mel.npy.npy	<machine motor humming& start>@<pressurized air releasing& mid>@<metal clanking& end>
Wind_blowing_hard_with_rustling_of_leaves.wav	audiocaps	Wind blowing hard with rustling of leaves	audio_wav_train/Wind_blowing_hard_with_rustling_of_leaves.wav	10.0	audio_wav_train_mel/Wind_blowing_hard_with_rustling_of_leaves_mel.npy.npy	<wind blowing hard& all>@<rustling of leaves& all>
Bell_ringing_and_a_low_ticking.wav	audiocaps	Bell ringing and a low ticking	audio_wav_train/Bell_ringing_and_a_low_ticking.wav	10.0	audio_wav_train_mel/Bell_ringing_and_a_low_ticking_mel.npy.npy	<bell ringing& all>@<low ticking& all>
High_pitched_whistling_following_by_low_whistling.wav	audiocaps	High pitched whistling following by low whistling	audio_wav_train/High_pitched_whistling_following_by_low_whistling.wav	10.0	audio_wav_train_mel/High_pitched_whistling_following_by_low_whistling_mel.npy.npy	<high pitched whistling& start>@<low whistling& mid>
A_car_speeds_by.wav	audiocaps	A car speeds by	audio_wav_train/A_car_speeds_by.wav	10.0	audio_wav_train_mel/A_car_speeds_by_mel.npy.npy	<car speeds by& all>
People_talking_with_a_dog_barking_in_the_back.wav	audiocaps	People talking with a dog barking in the back	audio_wav_train/People_talking_with_a_dog_barking_in_the_back.wav	10.0	audio_wav_train_mel/People_talking_with_a_dog_barking_in_the_back_mel.npy.npy	<people talking& all>@<dog barking& mid>
A_person_speaks_as_sizzling_food_is_stirred.wav	audiocaps	A person speaks as sizzling food is stirred	audio_wav_train/A_person_speaks_as_sizzling_food_is_stirred.wav	10.0	audio_wav_train_mel/A_person_speaks_as_sizzling_food_is_stirred_mel.npy.npy	<person speaks& all>@<sizzling food stirred& all>
Emergency_vehicle_siren_blowing_then_woman_speaking.wav	audiocaps	Emergency vehicle siren blowing then woman speaking	audio_wav_train/Emergency_vehicle_siren_blowing_then_woman_speaking.wav	10.0	audio_wav_train_mel/Emergency_vehicle_siren_blowing_then_woman_speaking_mel.npy.npy	<emergency vehicle siren blowing& start>@<woman speaking& end>
Sharp_drill_sound_with_person_speaking_in_background.wav	audiocaps	Sharp drill sound with person speaking in background	audio_wav_train/Sharp_drill_sound_with_person_speaking_in_background.wav	10.0	audio_wav_train_mel/Sharp_drill_sound_with_person_speaking_in_background_mel.npy.npy	<sharp drill sound& all>@<person speaking in background& all>
An_aircraft_motor_is_running_and_decelerates,_and_rhythmic_whirring,_vibration_and_whooshing_are_present.wav	audiocaps	An aircraft motor is running and decelerates, and rhythmic whirring, vibration and whooshing are present	audio_wav_train/An_aircraft_motor_is_running_and_decelerates,_and_rhythmic_whirring,_vibration_and_whooshing_are_present.wav	10.0	audio_wav_train_mel/An_aircraft_motor_is_running_and_decelerates,_and_rhythmic_whirring,_vibration_and_whooshing_are_present_mel.npy.npy	<aircraft motor running& all>@<decelerates& mid>@<rhythmic whirring& all>@<vibration& all>@<whooshing& all>
Music_plays_followed_by_a_door_opening_and_a_woman_sneezing.wav	audiocaps	Music plays followed by a door opening and a woman sneezing	audio_wav_train/Music_plays_followed_by_a_door_opening_and_a_woman_sneezing.wav	10.0	audio_wav_train_mel/Music_plays_followed_by_a_door_opening_and_a_woman_sneezing_mel.npy.npy	<music plays& start>@<door opening& mid>@<woman sneezing& end>
A_train_horn_blows_and_alarm_bells_ring_as_heavy_traffic_passes_by.wav	audiocaps	A train horn blows and alarm bells ring as heavy traffic passes by	audio_wav_train/A_train_horn_blows_and_alarm_bells_ring_as_heavy_traffic_passes_by.wav	10.0	audio_wav_train_mel/A_train_horn_blows_and_alarm_bells_ring_as_heavy_traffic_passes_by_mel.npy.npy	<train horn blows& start>@<alarm bells ring& mid>@<heavy traffic passes by& all>
A_car_engine_revving.wav	audiocaps	A car engine revving	audio_wav_train/A_car_engine_revving.wav	10.0	audio_wav_train_mel/A_car_engine_revving_mel.npy.npy	<car engine revving& all>
An_emergency_siren_going_off_as_a_truck_drives_by_followed_by_heavy_rain_falling_and_thunder_cracking_while_leaves_violently_rustle.wav	audiocaps	An emergency siren going off as a truck drives by followed by heavy rain falling and thunder cracking while leaves violently rustle	audio_wav_train/An_emergency_siren_going_off_as_a_truck_drives_by_followed_by_heavy_rain_falling_and_thunder_cracking_while_leaves_violently_rustle.wav	10.0	audio_wav_train_mel/An_emergency_siren_going_off_as_a_truck_drives_by_followed_by_heavy_rain_falling_and_thunder_cracking_while_leaves_violently_rustle_mel.npy.npy	<emergency siren& start>@<truck drives by& mid>@<heavy rain falling& mid>@<thunder cracking& mid>@<leaves rustle& all>
Laughter_with_a_child_speaking_followed_by_applause.wav	audiocaps	Laughter with a child speaking followed by applause	audio_wav_train/Laughter_with_a_child_speaking_followed_by_applause.wav	10.0	audio_wav_train_mel/Laughter_with_a_child_speaking_followed_by_applause_mel.npy.npy	<laughter& start>@<child speaking& mid>@<applause& end>
A_vehicle_accelerates.wav	audiocaps	A vehicle accelerates	audio_wav_train/A_vehicle_accelerates.wav	10.0	audio_wav_train_mel/A_vehicle_accelerates_mel.npy.npy	<vehicle accelerates& all>
A_crowd_is_clapping_and_cheering,_and_an_adult_male_speaks.wav	audiocaps	A crowd is clapping and cheering, and an adult male speaks	audio_wav_train/A_crowd_is_clapping_and_cheering,_and_an_adult_male_speaks.wav	10.0	audio_wav_train_mel/A_crowd_is_clapping_and_cheering,_and_an_adult_male_speaks_mel.npy.npy	<crowd clapping and cheering& all>@<adult male speaks& all>
A_vehicle_engine_runs.wav	audiocaps	A vehicle engine runs	audio_wav_train/A_vehicle_engine_runs.wav	10.0	audio_wav_train_mel/A_vehicle_engine_runs_mel.npy.npy	<vehicle engine runs& all>
A_woman_is_narrating_in_a_foreign_language.wav	audiocaps	A woman is narrating in a foreign language	audio_wav_train/A_woman_is_narrating_in_a_foreign_language.wav	10.0	audio_wav_train_mel/A_woman_is_narrating_in_a_foreign_language_mel.npy.npy	<woman narrating in a foreign language& all>
Water_splashing_and_gurgling_as_people_talk.wav	audiocaps	Water splashing and gurgling as people talk	audio_wav_train/Water_splashing_and_gurgling_as_people_talk.wav	10.0	audio_wav_train_mel/Water_splashing_and_gurgling_as_people_talk_mel.npy.npy	<water splashing and gurgling& all>@<people talk& all>
Heavy_rain_and_thunder_crashing.wav	audiocaps	Heavy rain and thunder crashing	audio_wav_train/Heavy_rain_and_thunder_crashing.wav	10.0	audio_wav_train_mel/Heavy_rain_and_thunder_crashing_mel.npy.npy	<heavy rain& all>@<thunder crashing& all>
Humming_and_sputtering_of_an_idling_engine_revving.wav	audiocaps	Humming and sputtering of an idling engine revving	audio_wav_train/Humming_and_sputtering_of_an_idling_engine_revving.wav	10.0	audio_wav_train_mel/Humming_and_sputtering_of_an_idling_engine_revving_mel.npy.npy	<idling engine humming& all>@<engine revving& mid>
A_toilet_flushing.wav	audiocaps	A toilet flushing	audio_wav_train/A_toilet_flushing.wav	10.0	audio_wav_train_mel/A_toilet_flushing_mel.npy.npy	<toilet flushing& all>
A_loud_engine_and_helicopter_blades_spin_constantly.wav	audiocaps	A loud engine and helicopter blades spin constantly	audio_wav_train/A_loud_engine_and_helicopter_blades_spin_constantly.wav	10.0	audio_wav_train_mel/A_loud_engine_and_helicopter_blades_spin_constantly_mel.npy.npy	<helicopter blades spin constantly& all>@<loud engine& all>
An_aircraft_motor_is_running_and_buzzing,_propellers_are_vibrating,_and_two_adult_males_speak_faintly_in_the_background.wav	audiocaps	An aircraft motor is running and buzzing, propellers are vibrating, and two adult males speak faintly in the background	audio_wav_train/An_aircraft_motor_is_running_and_buzzing,_propellers_are_vibrating,_and_two_adult_males_speak_faintly_in_the_background.wav	10.0	audio_wav_train_mel/An_aircraft_motor_is_running_and_buzzing,_propellers_are_vibrating,_and_two_adult_males_speak_faintly_in_the_background_mel.npy.npy	<aircraft motor running& all>@<buzzing& all>@<propellers vibrating& all>@<two adult males speak faintly& all>
A_female_speaking,_then_a_baby_babbling,_then_a_female_cheering_and_clapping,_followed_by_another_female_laughing_and_speaking.wav	audiocaps	A female speaking, then a baby babbling, then a female cheering and clapping, followed by another female laughing and speaking	audio_wav_train/A_female_speaking,_then_a_baby_babbling,_then_a_female_cheering_and_clapping,_followed_by_another_female_laughing_and_speaking.wav	10.0	audio_wav_train_mel/A_female_speaking,_then_a_baby_babbling,_then_a_female_cheering_and_clapping,_followed_by_another_female_laughing_and_speaking_mel.npy.npy	<female speaking& all>@<baby babbling& mid>@<female cheering and clapping& mid>@<another female laughing and speaking& end>
A_pigeon_coos_softly_and_then_there_is_a_lot_of_pecks_and_cooing_by_a_lot_of_birds.wav	audiocaps	A pigeon coos softly and then there is a lot of pecks and cooing by a lot of birds	audio_wav_train/A_pigeon_coos_softly_and_then_there_is_a_lot_of_pecks_and_cooing_by_a_lot_of_birds.wav	10.0	audio_wav_train_mel/A_pigeon_coos_softly_and_then_there_is_a_lot_of_pecks_and_cooing_by_a_lot_of_birds_mel.npy.npy	<soft pigeon cooing& start>@<lots of pecks and cooing by birds& all>
A_high_pitched_engine_running_consistently.wav	audiocaps	A high pitched engine running consistently	audio_wav_train/A_high_pitched_engine_running_consistently.wav	10.0	audio_wav_train_mel/A_high_pitched_engine_running_consistently_mel.npy.npy	<high pitched engine running consistently& all>
An_emergency_siren_powering_down_followed_by_audio_hissing_and_muffled_metal_clanging.wav	audiocaps	An emergency siren powering down followed by audio hissing and muffled metal clanging	audio_wav_train/An_emergency_siren_powering_down_followed_by_audio_hissing_and_muffled_metal_clanging.wav	10.0	audio_wav_train_mel/An_emergency_siren_powering_down_followed_by_audio_hissing_and_muffled_metal_clanging_mel.npy.npy	<emergency siren powering down& start>@<audio hissing& mid>@<muffled metal clanging& end>
Engine_idling_then_beginning_to_rev_up.wav	audiocaps	Engine idling then beginning to rev up	audio_wav_train/Engine_idling_then_beginning_to_rev_up.wav	10.0	audio_wav_train_mel/Engine_idling_then_beginning_to_rev_up_mel.npy.npy	<engine idling& all>@<engine revs up& start>
Crashing_waves_and_a_gust_of_wind.wav	audiocaps	Crashing waves and a gust of wind	audio_wav_train/Crashing_waves_and_a_gust_of_wind.wav	10.0	audio_wav_train_mel/Crashing_waves_and_a_gust_of_wind_mel.npy.npy	<crashing waves& all>@<gust of wind& all>
People_are_talking_and_bees_are_quietly_buzzing_in_the_background.wav	audiocaps	People are talking and bees are quietly buzzing in the background	audio_wav_train/People_are_talking_and_bees_are_quietly_buzzing_in_the_background.wav	10.0	audio_wav_train_mel/People_are_talking_and_bees_are_quietly_buzzing_in_the_background_mel.npy.npy	<people talking& all>@<bees buzzing& all>
A_duck_quacks_multiple_times.wav	audiocaps	A duck quacks multiple times	audio_wav_train/A_duck_quacks_multiple_times.wav	10.0	audio_wav_train_mel/A_duck_quacks_multiple_times_mel.npy.npy	<duck quacks& all>
Several_young_people_are_speaking_and_laughing,_and_young_people_are_also_speaking_in_the_background.wav	audiocaps	Several young people are speaking and laughing, and young people are also speaking in the background	audio_wav_train/Several_young_people_are_speaking_and_laughing,_and_young_people_are_also_speaking_in_the_background.wav	10.0	audio_wav_train_mel/Several_young_people_are_speaking_and_laughing,_and_young_people_are_also_speaking_in_the_background_mel.npy.npy	<young people speaking and laughing& all>@<background speaking& all>
A_large_clock_chimes.wav	audiocaps	A large clock chimes	audio_wav_train/A_large_clock_chimes.wav	10.0	audio_wav_train_mel/A_large_clock_chimes_mel.npy.npy	<large clock chimes& all>
Water_running_continuously.wav	audiocaps	Water running continuously	audio_wav_train/Water_running_continuously.wav	10.0	audio_wav_train_mel/Water_running_continuously_mel.npy.npy	<water running continuously& all>
A_file_rubs_against_an_object_nearby,_followed_by_a_man_speaking.wav	audiocaps	A file rubs against an object nearby, followed by a man speaking	audio_wav_train/A_file_rubs_against_an_object_nearby,_followed_by_a_man_speaking.wav	10.0	audio_wav_train_mel/A_file_rubs_against_an_object_nearby,_followed_by_a_man_speaking_mel.npy.npy	<file rubs against an object& start>@<man speaking& mid>
A_door_is_sliding_open.wav	audiocaps	A door is sliding open	audio_wav_train/A_door_is_sliding_open.wav	10.0	audio_wav_train_mel/A_door_is_sliding_open_mel.npy.npy	<door sliding open& all>
Vehicle's_engines_are_running_and_a_man_speaks_over_a_loud_system.wav	audiocaps	Vehicle's engines are running and a man speaks over a loud system	audio_wav_train/Vehicle's_engines_are_running_and_a_man_speaks_over_a_loud_system.wav	10.0	audio_wav_train_mel/Vehicle's_engines_are_running_and_a_man_speaks_over_a_loud_system_mel.npy.npy	<vehicle's engines running& all>@<man speaks over loud system& all>
Crackling_followed_by_an_explosion.wav	audiocaps	Crackling followed by an explosion	audio_wav_train/Crackling_followed_by_an_explosion.wav	10.0	audio_wav_train_mel/Crackling_followed_by_an_explosion_mel.npy.npy	<crackling& start>@<explosion& end>
Approaching_vehicle_with_blowout,_birds_in_background.wav	audiocaps	Approaching vehicle with blowout, birds in background	audio_wav_train/Approaching_vehicle_with_blowout,_birds_in_background.wav	10.0	audio_wav_train_mel/Approaching_vehicle_with_blowout,_birds_in_background_mel.npy.npy	<approaching vehicle sound& all>@<blowout sound& start>@<birds chirping& all>
Power_tools_are_drilling.wav	audiocaps	Power tools are drilling	audio_wav_train/Power_tools_are_drilling.wav	10.0	audio_wav_train_mel/Power_tools_are_drilling_mel.npy.npy	<power tools are drilling& all>
A_person_speaking_followed_by_some_light_banging.wav	audiocaps	A person speaking followed by some light banging	audio_wav_train/A_person_speaking_followed_by_some_light_banging.wav	10.0	audio_wav_train_mel/A_person_speaking_followed_by_some_light_banging_mel.npy.npy	<person speaking& all>@<light banging& mid>
A_woman_speaking_and_a_soft_scraping_noise.wav	audiocaps	A woman speaking and a soft scraping noise	audio_wav_train/A_woman_speaking_and_a_soft_scraping_noise.wav	10.0	audio_wav_train_mel/A_woman_speaking_and_a_soft_scraping_noise_mel.npy.npy	<woman speaking& all>@<soft scraping noise& all>
A_explosion_and_a_man_speaking.wav	audiocaps	A explosion and a man speaking	audio_wav_train/A_explosion_and_a_man_speaking.wav	10.0	audio_wav_train_mel/A_explosion_and_a_man_speaking_mel.npy.npy	<explosion& start>@<man speaking& all>
Strong_wind_noise_with_birds_tweeting_and_a_man_talks.wav	audiocaps	Strong wind noise with birds tweeting and a man talks	audio_wav_train/Strong_wind_noise_with_birds_tweeting_and_a_man_talks.wav	10.0	audio_wav_train_mel/Strong_wind_noise_with_birds_tweeting_and_a_man_talks_mel.npy.npy	<strong wind noise& all>@<birds tweeting& all>@<man talks& all>
Wind_blows,_water_splashes,_people_speak.wav	audiocaps	Wind blows, water splashes, people speak	audio_wav_train/Wind_blows,_water_splashes,_people_speak.wav	10.0	audio_wav_train_mel/Wind_blows,_water_splashes,_people_speak_mel.npy.npy	<wind blows& all>@<water splashes& all>@<people speak& all>
Clanking_followed_by_speech_and_then_several_fast_gunshots.wav	audiocaps	Clanking followed by speech and then several fast gunshots	audio_wav_train/Clanking_followed_by_speech_and_then_several_fast_gunshots.wav	10.0	audio_wav_train_mel/Clanking_followed_by_speech_and_then_several_fast_gunshots_mel.npy.npy	<clanking& start>@<speech& mid>@<fast gunshots& end>
A_bird_flaps_up_nearby_and_then_starts_to_tweet_numerous_times_loudly.wav	audiocaps	A bird flaps up nearby and then starts to tweet numerous times loudly	audio_wav_train/A_bird_flaps_up_nearby_and_then_starts_to_tweet_numerous_times_loudly.wav	10.0	audio_wav_train_mel/A_bird_flaps_up_nearby_and_then_starts_to_tweet_numerous_times_loudly_mel.npy.npy	<bird flaps up nearby& start>@<bird tweets loudly numerous times& all>
Water_is_flowing_down.wav	audiocaps	Water is flowing down	audio_wav_train/Water_is_flowing_down.wav	10.0	audio_wav_train_mel/Water_is_flowing_down_mel.npy.npy	<water flowing down& all>
A_bell_chimes_several_times.wav	audiocaps	A bell chimes several times	audio_wav_train/A_bell_chimes_several_times.wav	10.0	audio_wav_train_mel/A_bell_chimes_several_times_mel.npy.npy	<bell chimes& all>
In_a_quiet_environment,_an_adult_male_is_speaking.wav	audiocaps	In a quiet environment, an adult male is speaking	audio_wav_train/In_a_quiet_environment,_an_adult_male_is_speaking.wav	10.0	audio_wav_train_mel/In_a_quiet_environment,_an_adult_male_is_speaking_mel.npy.npy	<adult male is speaking& all>
An_adult_male_is_speaking,_a_motor_is_running,_rhythmic_vibration,_and_water_is_gurgling.wav	audiocaps	An adult male is speaking, a motor is running, rhythmic vibration, and water is gurgling	audio_wav_train/An_adult_male_is_speaking,_a_motor_is_running,_rhythmic_vibration,_and_water_is_gurgling.wav	10.0	audio_wav_train_mel/An_adult_male_is_speaking,_a_motor_is_running,_rhythmic_vibration,_and_water_is_gurgling_mel.npy.npy	<adult male speaking& all>@<motor running& all>@<water gurgling& all>@<rhythmic vibration& all>
A_burst_of_wind_followed_by_a_loud_splash_then_a_man_speaks_followed_by_a_goofy_sound_effect.wav	audiocaps	A burst of wind followed by a loud splash then a man speaks followed by a goofy sound effect	audio_wav_train/A_burst_of_wind_followed_by_a_loud_splash_then_a_man_speaks_followed_by_a_goofy_sound_effect.wav	10.0	audio_wav_train_mel/A_burst_of_wind_followed_by_a_loud_splash_then_a_man_speaks_followed_by_a_goofy_sound_effect_mel.npy.npy	<burst of wind& start>@<loud splash& mid>@<man speaks& mid>@<goofy sound effect& end>
A_baby_laughs_and_a_silly_man_makes_turkey_gobble_sounds.wav	audiocaps	A baby laughs and a silly man makes turkey gobble sounds	audio_wav_train/A_baby_laughs_and_a_silly_man_makes_turkey_gobble_sounds.wav	10.0	audio_wav_train_mel/A_baby_laughs_and_a_silly_man_makes_turkey_gobble_sounds_mel.npy.npy	<baby laughs& all>@<silly man makes turkey gobble sounds& all>
A_horse_neighing_in_the_background.wav	audiocaps	A horse neighing in the background	audio_wav_train/A_horse_neighing_in_the_background.wav	10.0	audio_wav_train_mel/A_horse_neighing_in_the_background_mel.npy.npy	<horse neighing& all>
A_machine_is_running_and_then_stops.wav	audiocaps	A machine is running and then stops	audio_wav_train/A_machine_is_running_and_then_stops.wav	10.0	audio_wav_train_mel/A_machine_is_running_and_then_stops_mel.npy.npy	<machine is running& start>@<machine stops& end>
A_siren_wails_continuously.wav	audiocaps	A siren wails continuously	audio_wav_train/A_siren_wails_continuously.wav	10.0	audio_wav_train_mel/A_siren_wails_continuously_mel.npy.npy	<sirens wail continuously& all>
Humming_followed_by_a_dog_barking.wav	audiocaps	Humming followed by a dog barking	audio_wav_train/Humming_followed_by_a_dog_barking.wav	10.0	audio_wav_train_mel/Humming_followed_by_a_dog_barking_mel.npy.npy	<humming& start>@<dog barking& end>
An_aircraft_flies_nearby.wav	audiocaps	An aircraft flies nearby	audio_wav_train/An_aircraft_flies_nearby.wav	10.0	audio_wav_train_mel/An_aircraft_flies_nearby_mel.npy.npy	<aircraft flies nearby& all>
A_man_speaks_followed_by_a_series_of_whistles.wav	audiocaps	A man speaks followed by a series of whistles	audio_wav_train/A_man_speaks_followed_by_a_series_of_whistles.wav	10.0	audio_wav_train_mel/A_man_speaks_followed_by_a_series_of_whistles_mel.npy.npy	<male voice speaks& all>@<series of whistles& start>
A_helicopter_over_the_waves_with_the_pilot_audible.wav	audiocaps	A helicopter over the waves with the pilot audible	audio_wav_train/A_helicopter_over_the_waves_with_the_pilot_audible.wav	10.0	audio_wav_train_mel/A_helicopter_over_the_waves_with_the_pilot_audible_mel.npy.npy	<helicopter over the waves& all>@<pilot audible& all>
Static_in_the_background_while_a_child_snores_rhythmically.wav	audiocaps	Static in the background while a child snores rhythmically	audio_wav_train/Static_in_the_background_while_a_child_snores_rhythmically.wav	10.0	audio_wav_train_mel/Static_in_the_background_while_a_child_snores_rhythmically_mel.npy.npy	<static in the background& all>@<child snores rhythmically& all>
Motorcycle_driving_away_at_high_speeds.wav	audiocaps	Motorcycle driving away at high speeds	audio_wav_train/Motorcycle_driving_away_at_high_speeds.wav	10.0	audio_wav_train_mel/Motorcycle_driving_away_at_high_speeds_mel.npy.npy	<motorcycle driving away at high speeds& all>
